{
  "schema": "h3.context.nle_hardening_coverage_manifest.v1",
  "version": 1,
  "surface": "overlay_v1",
  "joined_sources": {
    "control_coverage_manifest_sha256": "sha256:921399a9f7d1aa9f3aea76fc25c90b89e9a0c8f0fefbb22018a4ba165c5323d9",
    "sidebar_editor_ui_contract_sha256": "sha256:3a0bba2e967f413fafef6784b3a9691811a9fb390a271bac882ff8aadf68eede"
  },
  "fixtures": {
    "smoke": "M25-16-overlay-v1-smoke",
    "stress": "NLE-STRESS-V1",
    "render": "NLE-STRESS-RENDER-V1",
    "ui_stress": "UI-CONTRACT-STRESS-V1"
  },
  "dimensions": [
    "accessibility",
    "stress",
    "recovery"
  ],
  "command_rows": [
    {
      "command": "create_track",
      "operation_id": "track.add",
      "control_selector": "[data-h3-nle-control=\"track.add\"]",
      "role": "menuitem",
      "accessible_name": "Add track",
      "recovery_injection": "response_loss",
      "evidence": {
        "accessibility_evidence_id": "e2e/journeys/nleHardeningCommands.spec.ts::hardening a11y track.add is a named 44px touch target that issues one create_track and keeps focus in the editor",
        "stress_evidence_id": "e2e/journeys/nleHardeningStress.spec.ts::NLE-STRESS-V1 scheduled edit phase accepts and refuses every command within the edit budgets",
        "recovery_evidence_id": "e2e/journeys/nleHardeningCommands.spec.ts::hardening recovery track.add lost reply after the core accepted create_track reconciles read-only without replay"
      }
    },
    {
      "command": "remove_track",
      "operation_id": "track.remove",
      "control_selector": "[data-h3-nle-control=\"track.remove\"]",
      "role": "menuitem",
      "accessible_name": "Remove track",
      "recovery_injection": "response_loss",
      "evidence": {
        "accessibility_evidence_id": "e2e/journeys/nleHardeningCommands.spec.ts::hardening a11y track.remove is a named 44px touch target that issues one remove_track and keeps focus in the editor",
        "stress_evidence_id": "e2e/journeys/nleHardeningStress.spec.ts::NLE-STRESS-V1 scheduled edit phase accepts and refuses every command within the edit budgets",
        "recovery_evidence_id": "e2e/journeys/nleHardeningCommands.spec.ts::hardening recovery track.remove lost reply after the core accepted remove_track reconciles read-only without replay"
      }
    },
    {
      "command": "reorder_track",
      "operation_id": "track.reorder",
      "control_selector": "[data-h3-nle-control=\"track.reorder\"]",
      "role": "menuitem",
      "accessible_name": "Reorder track",
      "recovery_injection": "response_loss",
      "evidence": {
        "accessibility_evidence_id": "e2e/journeys/nleHardeningCommands.spec.ts::hardening a11y track.reorder is a named 44px touch target that issues one reorder_track and keeps focus in the editor",
        "stress_evidence_id": "e2e/journeys/nleHardeningStress.spec.ts::NLE-STRESS-V1 scheduled edit phase accepts and refuses every command within the edit budgets",
        "recovery_evidence_id": "e2e/journeys/nleHardeningCommands.spec.ts::hardening recovery track.reorder lost reply after the core accepted reorder_track reconciles read-only without replay"
      }
    },
    {
      "command": "set_track_enabled",
      "operation_id": "track.enabled",
      "control_selector": "[data-h3-nle-control=\"track.enabled\"]",
      "role": "button",
      "accessible_name": "Show {track}",
      "recovery_injection": "response_loss",
      "evidence": {
        "accessibility_evidence_id": "e2e/journeys/nleHardeningCommands.spec.ts::hardening a11y track.enabled is a named 44px touch target that issues one set_track_enabled and keeps focus in the editor",
        "stress_evidence_id": "e2e/journeys/nleHardeningStress.spec.ts::NLE-STRESS-V1 scheduled edit phase accepts and refuses every command within the edit budgets",
        "recovery_evidence_id": "e2e/journeys/nleHardeningCommands.spec.ts::hardening recovery track.enabled lost reply after the core accepted set_track_enabled reconciles read-only without replay"
      }
    },
    {
      "command": "set_track_locked",
      "operation_id": "track.locked",
      "control_selector": "[data-h3-nle-control=\"track.locked\"]",
      "role": "button",
      "accessible_name": "Lock {track}",
      "recovery_injection": "response_loss",
      "evidence": {
        "accessibility_evidence_id": "e2e/journeys/nleHardeningCommands.spec.ts::hardening a11y track.locked is a named 44px touch target that issues one set_track_locked and keeps focus in the editor",
        "stress_evidence_id": "e2e/journeys/nleHardeningStress.spec.ts::NLE-STRESS-V1 scheduled edit phase accepts and refuses every command within the edit budgets",
        "recovery_evidence_id": "e2e/journeys/nleHardeningCommands.spec.ts::hardening recovery track.locked lost reply after the core accepted set_track_locked reconciles read-only without replay"
      }
    },
    {
      "command": "insert_asset_clip",
      "operation_id": "asset.insert",
      "control_selector": "[data-h3-nle-control=\"asset.insert\"]",
      "role": "button",
      "accessible_name": "Add {asset} to the timeline",
      "recovery_injection": "response_loss",
      "evidence": {
        "accessibility_evidence_id": "e2e/journeys/nleHardeningCommands.spec.ts::hardening a11y asset.insert is a named 44px touch target that issues one insert_asset_clip and keeps focus in the editor",
        "stress_evidence_id": "e2e/journeys/nleHardeningStress.spec.ts::NLE-STRESS-V1 scheduled edit phase accepts and refuses every command within the edit budgets",
        "recovery_evidence_id": "e2e/journeys/nleHardeningCommands.spec.ts::hardening recovery asset.insert lost reply after the core accepted insert_asset_clip reconciles read-only without replay"
      }
    },
    {
      "command": "insert_title_clip",
      "operation_id": "title.insert",
      "control_selector": "[data-h3-nle-control=\"title.insert\"]",
      "role": "button",
      "accessible_name": "Add title",
      "recovery_injection": "response_loss",
      "evidence": {
        "accessibility_evidence_id": "e2e/journeys/nleHardeningCommands.spec.ts::hardening a11y title.insert is a named 44px touch target that issues one insert_title_clip and keeps focus in the editor",
        "stress_evidence_id": "e2e/journeys/nleHardeningStress.spec.ts::NLE-STRESS-V1 scheduled edit phase accepts and refuses every command within the edit budgets",
        "recovery_evidence_id": "e2e/journeys/nleHardeningCommands.spec.ts::hardening recovery title.insert lost reply after the core accepted insert_title_clip reconciles read-only without replay"
      }
    },
    {
      "command": "replace_clip_asset",
      "operation_id": "asset.replace",
      "control_selector": "[data-h3-nle-control=\"asset.replace\"]",
      "role": "menuitem",
      "accessible_name": "Replace clip asset",
      "recovery_injection": "response_loss",
      "evidence": {
        "accessibility_evidence_id": "e2e/journeys/nleHardeningCommands.spec.ts::hardening a11y asset.replace is a named 44px touch target that issues one replace_clip_asset and keeps focus in the editor",
        "stress_evidence_id": "e2e/journeys/nleHardeningStress.spec.ts::NLE-STRESS-V1 scheduled edit phase accepts and refuses every command within the edit budgets",
        "recovery_evidence_id": "e2e/journeys/nleHardeningCommands.spec.ts::hardening recovery asset.replace lost reply after the core accepted replace_clip_asset reconciles read-only without replay"
      }
    },
    {
      "command": "remove_clip",
      "operation_id": "clip.remove",
      "control_selector": "[data-h3-nle-control=\"clip.remove\"]",
      "role": "button",
      "accessible_name": "Delete",
      "recovery_injection": "response_loss",
      "evidence": {
        "accessibility_evidence_id": "e2e/journeys/nleHardeningCommands.spec.ts::hardening a11y clip.remove is a named 44px touch target that issues one remove_clip and keeps focus in the editor",
        "stress_evidence_id": "e2e/journeys/nleHardeningStress.spec.ts::NLE-STRESS-V1 scheduled edit phase accepts and refuses every command within the edit budgets",
        "recovery_evidence_id": "e2e/journeys/nleHardeningCommands.spec.ts::hardening recovery clip.remove lost reply after the core accepted remove_clip reconciles read-only without replay"
      }
    },
    {
      "command": "move_clip",
      "operation_id": "clip.move",
      "control_selector": "[data-h3-nle-control=\"clip.move\"]",
      "role": "button",
      "accessible_name": "Move clip",
      "recovery_injection": "response_loss",
      "evidence": {
        "accessibility_evidence_id": "e2e/journeys/nleHardeningCommands.spec.ts::hardening a11y clip.move is a named 44px touch target that issues one move_clip and keeps focus in the editor",
        "stress_evidence_id": "e2e/journeys/nleHardeningStress.spec.ts::NLE-STRESS-V1 scheduled edit phase accepts and refuses every command within the edit budgets",
        "recovery_evidence_id": "e2e/journeys/nleHardeningCommands.spec.ts::hardening recovery clip.move lost reply after the core accepted move_clip reconciles read-only without replay"
      }
    },
    {
      "command": "move_group",
      "operation_id": "clip.move_group",
      "control_selector": "[data-h3-nle-control=\"clip.move_group\"]",
      "role": "button",
      "accessible_name": "Move selected group",
      "recovery_injection": "response_loss",
      "evidence": {
        "accessibility_evidence_id": "e2e/journeys/nleHardeningCommands.spec.ts::hardening a11y clip.move_group is a named 44px touch target that issues one move_group and keeps focus in the editor",
        "stress_evidence_id": "e2e/journeys/nleHardeningStress.spec.ts::NLE-STRESS-V1 scheduled edit phase accepts and refuses every command within the edit budgets",